{
  "fingerprint": "1f8e95b79b9fe052",
  "title": "[Product Grid & Display] The cart count badge increments by 1 after adding the product",
  "source": "mission",
  "status": "candidate",
  "severity": "critical",
  "test_id": "SM-007",
  "requirement_ref": {
    "source": "DOC",
    "locator": "input/feature/requirement.md",
    "quote": "An actionable \"Add to Cart\" button.",
    "content_hash": "sha256:2f4a3b02b9e13b375cec84f00278283e"
  },
  "environment": {
    "url": "https://buggyqa.vercel.app/",
    "build": "unknown",
    "browser": "chromium",
    "role": "guest",
    "run_id": "20260912122319-v4hg",
    "observed_at": "2026-09-12T12:23:42.493Z"
  },
  "summary": "Verify clicking 'Add to Cart' on a product card increments the cart count badge. The application did not behave as the requirement describes. A deterministic replay reproduced it identically, so this is not flakiness.",
  "preconditions": [
    "Application is loaded at the home page",
    "At least one product card is visible in the All Products grid",
    "Cart badge currently shows a known count (e.g. 0)"
  ],
  "steps_to_reproduce": [
    "1. navigate → https://buggyqa.vercel.app/",
    "2. click on `getByRole('button', { name: 'Add to Cart' })`"
  ],
  "expected": "The cart count badge increments by 1 after adding the product.",
  "actual": "element not found on the page\n\nCould not identify \"Cart item count badge next to cart icon\". Tried: role_name:getByRole('status', { name: 'Cart count' }). Reporting rather than guessing.",
  "evidence": [
    {
      "kind": "log",
      "path": "runs/SM-007/20260912122319-v4hg-replay/execution.log"
    },
    {
      "kind": "snapshot",
      "path": "runs/SM-007/20260912122319-v4hg-replay/failure-snapshot.yaml"
    },
    {
      "kind": "screenshot",
      "path": "runs/SM-007/20260912122319-v4hg-replay/failure.png"
    },
    {
      "kind": "trace",
      "path": "runs/SM-007/20260912122319-v4hg-replay/trace.zip"
    },
    {
      "kind": "log",
      "path": "runs/SM-007/20260912122319-v4hg/execution.log"
    },
    {
      "kind": "snapshot",
      "path": "runs/SM-007/20260912122319-v4hg/failure-snapshot.yaml"
    },
    {
      "kind": "screenshot",
      "path": "runs/SM-007/20260912122319-v4hg/failure.png"
    },
    {
      "kind": "trace",
      "path": "runs/SM-007/20260912122319-v4hg/trace.zip"
    }
  ],
  "classification": {
    "failure_classification": "INCONCLUSIVE",
    "confidence": "MEDIUM",
    "rationale": [
      "The flow completed and 1 critical assertion(s) did not hold: A1.",
      "Every action the agent performed succeeded, so the failure is in the outcome, not the operation.",
      "A deterministic replay failed the same way.",
      "Every failing assertion failed because its element could not be found, not because it held the wrong value. That is equally consistent with a stale or invented target descriptor as with a real defect — check the failure snapshot before treating this as a product bug."
    ]
  },
  "first_seen": "2026-09-12T14:14:27.345Z",
  "last_seen": "2026-09-12T14:26:19.500Z",
  "occurrences": 8,
  "seen_in_builds": [
    "unknown"
  ]
}
