{
  "fingerprint": "2b1b5d19b6f7093a",
  "title": "[Global Navigation] The cart icon element exposes a non-empty accessible name (e.g. 'Cart')",
  "source": "mission",
  "status": "candidate",
  "severity": "minor",
  "test_id": "SM-005",
  "requirement_ref": {
    "source": "DOC",
    "locator": "input/feature/requirement.md",
    "quote": "The navigation menu contains an empty bracket set [] next to the Checkout link in the raw text structure, which likely correlates to a missing or improperly labeled accessibility tag for the Cart icon.",
    "content_hash": "sha256:2f4a3b02b9e13b375cec84f00278283e"
  },
  "environment": {
    "url": "https://buggyqa.vercel.app/",
    "build": "unknown",
    "browser": "chromium",
    "role": "guest",
    "run_id": "20260912122254-zufc",
    "observed_at": "2026-09-12T12:22:55.791Z"
  },
  "summary": "Verify the cart icon in the navigation bar has a proper accessible name. The run ended INCONCLUSIVE rather than passing.",
  "preconditions": [
    "Application is loaded at the home page"
  ],
  "steps_to_reproduce": [
    "1. navigate → https://buggyqa.vercel.app/"
  ],
  "expected": "The cart icon element exposes a non-empty accessible name (e.g. 'Cart').",
  "actual": "multiple matching elements\n\n\"Shopping cart icon in top navigation bar\" matched 2 elements via role_name. The mission did not set expect_multiple, so the agent will not choose one.",
  "evidence": [
    {
      "kind": "log",
      "path": "runs/SM-005/20260912122254-zufc/execution.log"
    },
    {
      "kind": "snapshot",
      "path": "runs/SM-005/20260912122254-zufc/failure-snapshot.yaml"
    },
    {
      "kind": "screenshot",
      "path": "runs/SM-005/20260912122254-zufc/failure.png"
    },
    {
      "kind": "trace",
      "path": "runs/SM-005/20260912122254-zufc/trace.zip"
    }
  ],
  "classification": {
    "failure_classification": "INCONCLUSIVE",
    "confidence": "MEDIUM",
    "rationale": [
      "At least one critical assertion could not be turned into a real expectation, so neither PASS nor FAIL can be justified."
    ]
  },
  "first_seen": "2026-09-12T14:14:27.332Z",
  "last_seen": "2026-09-12T14:26:19.477Z",
  "occurrences": 8,
  "seen_in_builds": [
    "unknown"
  ]
}
