{
  "fingerprint": "7736f33ad03749c3",
  "title": "[Page integrity sweep] Image failed to load",
  "source": "exploration",
  "status": "candidate",
  "severity": "minor",
  "environment": {
    "url": "https://buggyqa.vercel.app/",
    "build": "unknown",
    "browser": "chromium",
    "run_id": "20260912130109-igaq",
    "observed_at": "2026-09-12T14:44:37.708Z"
  },
  "summary": "Image failed to load\n\nNobody wrote a test case for this. It was noticed while walking the page during another test, which is the only reason it is here at all. Seen 2 times in one run.",
  "steps_to_reproduce": [
    "1. Open https://buggyqa.vercel.app/",
    "2. Observe the behaviour described above."
  ],
  "expected": "Not stated by any requirement — this is an observation, and someone who knows the product must decide whether it is a defect.",
  "actual": "https://buggyqa.vercel.app/_next/image?url=https%3A%2F%2Fimages.unsplash.com%2Fphoto-1454165833767-027508992bdb%3Fw%3D1200%26h%3D400%26fit%3Dcrop&w=1920&q=75",
  "first_seen": "2026-09-12T14:44:37.655Z",
  "last_seen": "2026-09-12T14:44:37.708Z",
  "occurrences": 12,
  "seen_in_builds": [
    "unknown"
  ]
}
