{
  "fingerprint": "cc47e7dc12b0c8bc",
  "title": "[Global Footer] The footer description text contains the correctly spelled word 'purpose', not 'perpose'",
  "source": "mission",
  "status": "candidate",
  "severity": "major",
  "test_id": "SM-003",
  "requirement_ref": {
    "source": "DOC",
    "locator": "input/feature/requirement.md",
    "quote": "In the brief description above the Quick Links, the word \"purpose\" is misspelled as \"perpose\".",
    "content_hash": "sha256:2f4a3b02b9e13b375cec84f00278283e"
  },
  "environment": {
    "url": "https://buggyqa.vercel.app/",
    "build": "unknown",
    "browser": "chromium",
    "role": "guest",
    "run_id": "20260912122229-elws",
    "observed_at": "2026-09-12T12:22:52.754Z"
  },
  "summary": "Verify the footer platform description spells 'purpose' correctly. The application did not behave as the requirement describes. A deterministic replay reproduced it identically, so this is not flakiness.",
  "preconditions": [
    "Application is loaded at the home page"
  ],
  "steps_to_reproduce": [
    "1. navigate → https://buggyqa.vercel.app/"
  ],
  "expected": "The footer description text contains the correctly spelled word 'purpose', not 'perpose'.",
  "actual": "expectation did not hold\n\n\u001b[2mexpect(\u001b[22m\u001b[31mlocator\u001b[39m\u001b[2m).\u001b[22mtoContainText\u001b[2m(\u001b[22m\u001b[32mexpected\u001b[39m\u001b[2m)\u001b[22m failed\n\nLocator: getByRole('contentinfo').first()\nExpected substring: \u001b[32m\"purpose\"\u001b[39m\nReceived string:    \u001b[31m\"Citrusbug QAthis website is created by Citrusbug QA team for testing perposeQuick LinksHomeProductsCartCheckoutContactEmail: qa.citrusbug@gmail.comPhone: +1 (555) 123-4567© 2026 Citrusbug QA team. All rights reserved. This is a QA practice website with intentional bugs.\"\u001b[39m\nTimeout: 10000ms\n\nCall log:\n\u001b[2m  - Expect \"toContainText\" getByRole('contentinfo').first() with timeout 10000ms\u001b[22m\n\u001b[2m  - waiting for getByRole('contentinfo').first()\u001b[22m\n\u001b[2m    23 × locator resolved to <footer class=\"jsx-50c24b8064df778a bg-gray-900 text-white mt-16\">…</footer>\u001b[22m\n\u001b[2m       - unexpected value \"Citrusbug QAthis website is created by Citrusbug QA team for testing perposeQuick LinksHomeProductsCartCheckoutContactEmail: qa.citrusbug@gmail.comPhone: +1 (555) 123-4567© 2026 Citrusbug QA team. All rights reserved. This is a QA practice website with intentional bugs.\"\u001b[22m\n",
  "evidence": [
    {
      "kind": "log",
      "path": "runs/SM-003/20260912122229-elws-replay/execution.log"
    },
    {
      "kind": "snapshot",
      "path": "runs/SM-003/20260912122229-elws-replay/failure-snapshot.yaml"
    },
    {
      "kind": "screenshot",
      "path": "runs/SM-003/20260912122229-elws-replay/failure.png"
    },
    {
      "kind": "trace",
      "path": "runs/SM-003/20260912122229-elws-replay/trace.zip"
    },
    {
      "kind": "log",
      "path": "runs/SM-003/20260912122229-elws/execution.log"
    },
    {
      "kind": "snapshot",
      "path": "runs/SM-003/20260912122229-elws/failure-snapshot.yaml"
    },
    {
      "kind": "screenshot",
      "path": "runs/SM-003/20260912122229-elws/failure.png"
    },
    {
      "kind": "trace",
      "path": "runs/SM-003/20260912122229-elws/trace.zip"
    }
  ],
  "classification": {
    "failure_classification": "PRODUCT_DEFECT",
    "confidence": "HIGH",
    "rationale": [
      "The flow completed and 1 critical assertion(s) did not hold: A1.",
      "Every action the agent performed succeeded, so the failure is in the outcome, not the operation.",
      "A deterministic replay failed the same way."
    ]
  },
  "first_seen": "2026-09-12T14:14:27.317Z",
  "last_seen": "2026-09-12T14:26:19.458Z",
  "occurrences": 4,
  "seen_in_builds": [
    "unknown"
  ]
}
