{
  "fingerprint": "5618182ab80fca3d",
  "title": "[ecommerce] Control has no accessible name: <a>",
  "source": "exploration",
  "status": "candidate",
  "severity": "trivial",
  "environment": {
    "url": "https://buggyqa.vercel.app/cart",
    "build": "unknown",
    "browser": "chromium",
    "observed_at": "2026-09-12T14:44:39.451Z"
  },
  "summary": "Control has no accessible name: <a>\n\nNobody wrote a test case for this. It was noticed while walking the page during another test, which is the only reason it is here at all.",
  "steps_to_reproduce": [
    "1. Open https://buggyqa.vercel.app/",
    "2. Observe the behaviour described above."
  ],
  "expected": "Not stated by any requirement — this is an observation, and someone who knows the product must decide whether it is a defect.",
  "actual": "href=\"/cart\" - icon-only - class=\"relative hover:scale-110 transition-transform\"",
  "first_seen": "2026-09-12T14:44:39.447Z",
  "last_seen": "2026-09-12T14:44:39.451Z",
  "occurrences": 2,
  "seen_in_builds": [
    "unknown"
  ]
}
