{
  "fingerprint": "077f08ac90106167",
  "title": "[Page integrity sweep] Every visible image on the home page loads successfully (no broken-image placeholders)",
  "source": "mission",
  "status": "candidate",
  "severity": "critical",
  "test_id": "EC-006",
  "requirement_ref": {
    "source": "DOC",
    "locator": "input/feature-ecommerce/requirement.md#r-4--product-grid--display",
    "quote": "Product Image ... An actionable \"Add to Cart\" button. A dedicated shopping cart icon to display or navigate to user selections.",
    "content_hash": "sha256:d93f44e1b0b4bfbdddc722d0c87757eb"
  },
  "environment": {
    "url": "https://buggyqa.vercel.app/",
    "build": "unknown",
    "browser": "chromium",
    "role": "Guest",
    "run_id": "20260912122211-531g",
    "observed_at": "2026-09-12T12:22:18.432Z"
  },
  "summary": "Verify every image on the home page actually loads. The application did not behave as the requirement describes. A deterministic replay reproduced it identically, so this is not flakiness.",
  "preconditions": [
    "STAGE is reachable and the home page loads",
    "Lazy-loaded images below the fold may not have loaded yet. The sweep reports those as unverified rather than failing them, so scroll position cannot produce a phantom failure."
  ],
  "steps_to_reproduce": [
    "1. navigate → https://buggyqa.vercel.app/",
    "2. wait_for_state with \"networkidle\""
  ],
  "expected": "Every visible image on the home page loads successfully (no broken-image placeholders).",
  "actual": "all_images_loaded: 12 checked, 2 failing\n    - Logo — failed to load (naturalWidth=0): https://buggyqa.vercel.app/broken-logo.png\n    - Think Like a Product owner — failed to load (naturalWidth=0): https://buggyqa.vercel.app/_next/image?url=https%3A%2F%2Fimages.unsplash.com%2Fphoto-1454165833767-027508992bdb%3Fw%3D1200%26h%3D400%26fit%3Dcrop&w=1920&q=75\n\n2 element(s) failed \"all_images_loaded\" (tolerance 0):\n  - Logo: failed to load (naturalWidth=0): https://buggyqa.vercel.app/broken-logo.png\n  - Think Like a Product owner: failed to load (naturalWidth=0): https://buggyqa.vercel.app/_next/image?url=https%3A%2F%2Fimages.unsplash.com%2Fphoto-1454165833767-027508992bdb%3Fw%3D1200%26h%3D400%26fit%3Dcrop&w=1920&q=75",
  "evidence": [
    {
      "kind": "log",
      "path": "runs/EC-006/20260912122211-531g-replay/execution.log"
    },
    {
      "kind": "snapshot",
      "path": "runs/EC-006/20260912122211-531g-replay/failure-snapshot.yaml"
    },
    {
      "kind": "screenshot",
      "path": "runs/EC-006/20260912122211-531g-replay/failure.png"
    },
    {
      "kind": "trace",
      "path": "runs/EC-006/20260912122211-531g-replay/trace.zip"
    },
    {
      "kind": "log",
      "path": "runs/EC-006/20260912122211-531g/execution.log"
    },
    {
      "kind": "snapshot",
      "path": "runs/EC-006/20260912122211-531g/failure-snapshot.yaml"
    },
    {
      "kind": "screenshot",
      "path": "runs/EC-006/20260912122211-531g/failure.png"
    },
    {
      "kind": "trace",
      "path": "runs/EC-006/20260912122211-531g/trace.zip"
    }
  ],
  "classification": {
    "failure_classification": "PRODUCT_DEFECT",
    "confidence": "HIGH",
    "rationale": [
      "The flow completed and 1 critical assertion(s) did not hold: A1.",
      "Every action the agent performed succeeded, so the failure is in the outcome, not the operation.",
      "A deterministic replay failed the same way."
    ]
  },
  "first_seen": "2026-09-12T14:44:37.653Z",
  "last_seen": "2026-09-12T14:44:37.656Z",
  "occurrences": 2,
  "seen_in_builds": [
    "unknown"
  ]
}
