{
  "fingerprint": "82120ed63d958abc",
  "title": "[Global Navigation] The brand logo image actually loads (not a broken-image placeholder)",
  "source": "mission",
  "status": "candidate",
  "severity": "critical",
  "test_id": "SM-002",
  "requirement_ref": {
    "source": "DOC",
    "locator": "input/feature/requirement.md",
    "quote": "The top-left brand logo fails to load properly, displaying a broken image placeholder icon in the browser viewport.",
    "content_hash": "sha256:2f4a3b02b9e13b375cec84f00278283e"
  },
  "environment": {
    "url": "https://buggyqa.vercel.app/",
    "build": "unknown",
    "browser": "chromium",
    "role": "guest",
    "run_id": "20260912122225-r4cc",
    "observed_at": "2026-09-12T12:22:29.105Z"
  },
  "summary": "Verify the brand logo image loads in the top navigation bar. The application did not behave as the requirement describes. A deterministic replay reproduced it identically, so this is not flakiness.",
  "preconditions": [
    "Application is loaded at the home page"
  ],
  "steps_to_reproduce": [
    "1. navigate → https://buggyqa.vercel.app/"
  ],
  "expected": "The brand logo image actually loads (not a broken-image placeholder).",
  "actual": "naturalWidth=0, src=https://buggyqa.vercel.app/broken-logo.png\n\nImage did not load (naturalWidth=0). The element is present but the image data is missing — a broken-image placeholder. src: https://buggyqa.vercel.app/broken-logo.png",
  "evidence": [
    {
      "kind": "log",
      "path": "runs/SM-002/20260912122225-r4cc-replay/execution.log"
    },
    {
      "kind": "snapshot",
      "path": "runs/SM-002/20260912122225-r4cc-replay/failure-snapshot.yaml"
    },
    {
      "kind": "screenshot",
      "path": "runs/SM-002/20260912122225-r4cc-replay/failure.png"
    },
    {
      "kind": "trace",
      "path": "runs/SM-002/20260912122225-r4cc-replay/trace.zip"
    },
    {
      "kind": "log",
      "path": "runs/SM-002/20260912122225-r4cc/execution.log"
    },
    {
      "kind": "snapshot",
      "path": "runs/SM-002/20260912122225-r4cc/failure-snapshot.yaml"
    },
    {
      "kind": "screenshot",
      "path": "runs/SM-002/20260912122225-r4cc/failure.png"
    },
    {
      "kind": "trace",
      "path": "runs/SM-002/20260912122225-r4cc/trace.zip"
    }
  ],
  "classification": {
    "failure_classification": "PRODUCT_DEFECT",
    "confidence": "HIGH",
    "rationale": [
      "The flow completed and 1 critical assertion(s) did not hold: A1.",
      "Every action the agent performed succeeded, so the failure is in the outcome, not the operation.",
      "A deterministic replay failed the same way."
    ]
  },
  "first_seen": "2026-09-12T14:44:37.671Z",
  "last_seen": "2026-09-12T14:44:37.674Z",
  "occurrences": 2,
  "seen_in_builds": [
    "unknown"
  ]
}
