{
  "fingerprint": "0b213fce219196fb",
  "title": "[Global Navigation] HTTP 404 — image",
  "source": "exploration",
  "status": "candidate",
  "severity": "minor",
  "environment": {
    "url": "https://buggyqa.vercel.app/",
    "build": "unknown",
    "browser": "chromium",
    "run_id": "20260912122254-zufc",
    "observed_at": "2026-09-12T14:26:19.478Z"
  },
  "summary": "HTTP 404 — image\n\nNobody wrote a test case for this. It was noticed while walking the page during another test, which is the only reason it is here at all.",
  "steps_to_reproduce": [
    "1. Open https://buggyqa.vercel.app/",
    "2. Observe the behaviour described above."
  ],
  "expected": "Not stated by any requirement — this is an observation, and someone who knows the product must decide whether it is a defect.",
  "actual": "https://buggyqa.vercel.app/broken-logo.png",
  "first_seen": "2026-09-12T14:14:27.297Z",
  "last_seen": "2026-09-12T14:26:19.478Z",
  "occurrences": 24,
  "seen_in_builds": [
    "unknown"
  ]
}
