{
  "fingerprint": "abdd616ce7516484",
  "title": "[Hero Carousel/Banner] The hero slide text reads 'Think Like a Product Owner' with consistent capitalization",
  "source": "mission",
  "status": "candidate",
  "severity": "minor",
  "test_id": "SM-004",
  "requirement_ref": {
    "source": "DOC",
    "locator": "input/feature/requirement.md",
    "quote": "In the hero slider text, the phrase \"Think Like a Product owner\" uses inconsistent title casing (the \"o\" in \"owner\" is lowercase while the rest are capitalized).",
    "content_hash": "sha256:2f4a3b02b9e13b375cec84f00278283e"
  },
  "environment": {
    "url": "https://buggyqa.vercel.app/",
    "build": "unknown",
    "browser": "chromium",
    "role": "guest",
    "run_id": "20260912122252-zzx3",
    "observed_at": "2026-09-12T12:22:54.446Z"
  },
  "summary": "Verify the hero slide phrase uses consistent title casing: 'Think Like a Product Owner'. The run ended INCONCLUSIVE rather than passing.",
  "preconditions": [
    "Application is loaded at the home page",
    "Hero slide 'Think Like a Product Owner' is visible or reachable via carousel navigation"
  ],
  "steps_to_reproduce": [
    "1. navigate → https://buggyqa.vercel.app/",
    "2. wait_for_state with \"load\""
  ],
  "expected": "The hero slide text reads 'Think Like a Product Owner' with consistent capitalization.",
  "actual": "multiple matching elements\n\n\"Hero carousel slide heading text\" matched 16 elements via role_name. The mission did not set expect_multiple, so the agent will not choose one.",
  "evidence": [
    {
      "kind": "log",
      "path": "runs/SM-004/20260912122252-zzx3/execution.log"
    },
    {
      "kind": "snapshot",
      "path": "runs/SM-004/20260912122252-zzx3/failure-snapshot.yaml"
    },
    {
      "kind": "screenshot",
      "path": "runs/SM-004/20260912122252-zzx3/failure.png"
    },
    {
      "kind": "trace",
      "path": "runs/SM-004/20260912122252-zzx3/trace.zip"
    }
  ],
  "classification": {
    "failure_classification": "INCONCLUSIVE",
    "confidence": "MEDIUM",
    "rationale": [
      "At least one critical assertion could not be turned into a real expectation, so neither PASS nor FAIL can be justified."
    ]
  },
  "first_seen": "2026-09-12T14:44:37.685Z",
  "last_seen": "2026-09-12T14:44:37.688Z",
  "occurrences": 2,
  "seen_in_builds": [
    "unknown"
  ]
}
