{
  "fingerprint": "3ec66555c2273285",
  "title": "[Global Footer] The footer description text contains the correctly spelled word 'purpose', not 'perpose'",
  "source": "mission",
  "status": "candidate",
  "severity": "major",
  "test_id": "SM-003",
  "requirement_ref": {
    "source": "DOC",
    "locator": "input/feature/requirement.md",
    "quote": "In the brief description above the Quick Links, the word \"purpose\" is misspelled as \"perpose\".",
    "content_hash": "sha256:2f4a3b02b9e13b375cec84f00278283e"
  },
  "environment": {
    "url": "https://buggyqa.vercel.app/",
    "build": "unknown",
    "browser": "chromium",
    "role": "guest",
    "run_id": "20260912120500-7fpc",
    "observed_at": "2026-09-12T12:05:23.654Z"
  },
  "summary": "Verify the footer platform description spells 'purpose' correctly. The application did not behave as the requirement describes. A deterministic replay reproduced it identically, so this is not flakiness.",
  "preconditions": [
    "Application is loaded at the home page"
  ],
  "steps_to_reproduce": [
    "1. navigate → https://buggyqa.vercel.app/"
  ],
  "expected": "The footer description text contains the correctly spelled word 'purpose', not 'perpose'.",
  "actual": "expectation did not hold\n\nexpect(locator).toContainText(expected) failed\n\nLocator: getByRole('contentinfo').first()\nExpected substring: \"purpose\"\nReceived string:    \"Citrusbug QAthis website is created by Citrusbug QA team for testing perposeQuick LinksHomeProductsCartCheckoutContactEmail: qa.citrusbug@gmail.comPhone: +1 (555) 123-4567© 2026 Citrusbug QA team. All rights reserved. This is a QA practice website with intentional bugs.\"\nTimeout: 10000ms\n\nCall log:\n  - Expect \"toContainText\" getByRole('contentinfo').first() with timeout 10000ms\n  - waiting for getByRole('contentinfo').first()\n    23 × locator resolved to <footer class=\"jsx-50c24b8064df778a bg-gray-900 text-white mt-16\">…</footer>\n       - unexpected value \"Citrusbug QAthis website is created by Citrusbug QA team for testing perposeQuick LinksHomeProductsCartCheckoutContactEmail: qa.citrusbug@gmail.comPhone: +1 (555) 123-4567© 2026 Citrusbug QA team. All rights reserved. This is a QA practice website with intentional bugs.\"\n",
  "evidence": [
    {
      "kind": "log",
      "path": "runs/SM-003/20260912120500-7fpc-replay/execution.log"
    },
    {
      "kind": "snapshot",
      "path": "runs/SM-003/20260912120500-7fpc-replay/failure-snapshot.yaml"
    },
    {
      "kind": "screenshot",
      "path": "runs/SM-003/20260912120500-7fpc-replay/failure.png"
    },
    {
      "kind": "trace",
      "path": "runs/SM-003/20260912120500-7fpc-replay/trace.zip"
    },
    {
      "kind": "log",
      "path": "runs/SM-003/20260912120500-7fpc/execution.log"
    },
    {
      "kind": "snapshot",
      "path": "runs/SM-003/20260912120500-7fpc/failure-snapshot.yaml"
    },
    {
      "kind": "screenshot",
      "path": "runs/SM-003/20260912120500-7fpc/failure.png"
    },
    {
      "kind": "trace",
      "path": "runs/SM-003/20260912120500-7fpc/trace.zip"
    }
  ],
  "classification": {
    "failure_classification": "PRODUCT_DEFECT",
    "confidence": "HIGH",
    "rationale": [
      "The flow completed and 1 critical assertion(s) did not hold: A1.",
      "Every action the agent performed succeeded, so the failure is in the outcome, not the operation.",
      "A deterministic replay failed the same way."
    ]
  },
  "first_seen": "2026-09-12T14:14:27.313Z",
  "last_seen": "2026-09-12T14:26:19.452Z",
  "occurrences": 4,
  "seen_in_builds": [
    "unknown"
  ]
}
